{
  "_schema": "ruptura.vtt.core.regras_personagem.v1.4",
  "_meta": {
    "conteudo": "regras_personagem",
    "fontes": [
      {
        "arquivo": "9 ATRIBUTOS 7a60a1363552826c9f7681712a9719a7.md",
        "hash_sha256": "5a31b4310e3d98b7b19a3881879dea19ade0ff64a67ef4ea259ad11e1ae7fdce",
        "capitulo": "9. Atributos"
      },
      {
        "arquivo": "10 PERÍCIAS 5840a1363552825cb06a01c2c7118e11.md",
        "hash_sha256": "6200587914ca70e3f4cd8c34af867ba9cc4f064141443f409759d41d092a6702",
        "capitulo": "10. Perícias"
      },
      {
        "arquivo": "12 VIDA, ESTRESSE E MANA bab0a136355283feb01c019d92c71eec.md",
        "hash_sha256": "fea46566f5af883042e49a97832a6889914fab836dbb0d5508ff4278dbaaa64b",
        "capitulo": "12. Vida, Estresse e Mana"
      }
    ],
    "versao_schema": "1.4.0",
    "status_padrao": "published",
    "gerado_em": "2026-06-25",
    "observacoes": [
      "Atributos, perícias, derivados, requisitos de vertente, dano, colapso e descanso foram reunidos em um único pacote de regras-base.",
      "Perícias usam atributo principal e atributos contextuais na ordem declarada pelo capítulo de Perícias.",
      "Fórmulas são representadas como AST JSON para evitar eval em código.",
      "Condições associadas a tipos de dano foram registradas como possíveis, mas não automáticas; o VTT deve aplicar condição apenas quando o efeito/propriedade/magia/item declarar.",
      "v1.2: auditado contra o PRD consolidado.",
      "v1.2: Mana foi confirmada pelo PRD como 10 + (Ânimo × 2).",
      "v1.2: Descanso longo agora reseta Sobrecarga, conforme PRD.",
      "v1.2: PA base, pontos de vertente, talento inicial e compra inicial foram adicionados à criação de personagem.",
      "v1.2: Recuperação paga foi marcada como fora do roadmap inicial, sem automação ativa.",
      "v1.2: Reações, Sobrecarga, Ruptura e faixas de Integridade foram adicionadas como regras-base.",
      "Contrato de binding de tags: alvo_tags de um efeito casa contra a UNIAO {id_da_pericia_da_rolagem} ∪ {tags_rolagem semanticas da rolagem}. IDs de pericia (luta, mobilidade, reflexos, etc.) sao alvo_tags validos sem precisar estar duplicados em tags_rolagem. A tag \"acao\" marca qualquer rolagem de acao (usada por Atordoado/Inconsciente para bloquear).",
      "v1.4: atributos_alternativos agora usa sempre {atributo, contexto}; campo condicao não é aceito."
    ],
    "auditoria_prd": {
      "arquivo": "Ruptura VTT — Documento de Requisitos Consolidado 3890a1363552807a8827ead34e804d89.md",
      "hash_sha256": "86b400b99d34f6d5e215dafe4abf9a5b41a8dcef3169c3d4cfef6c164e0cf687",
      "resultado": "corrigido_para_alinhamento_com_prd"
    },
    "revisao": " | v1.3.1: sociedade atributos_alternativos=[animo] (faltava). | v1.4: sociedade.atributos_alternativos corrigido de condicao para contexto; schema passa a estruturar atributos_alternativos."
  },
  "enums": {
    "atributos": [
      "corpo",
      "mente",
      "animo"
    ],
    "pericias": [
      "arcanismo",
      "artes",
      "balistica",
      "biologia",
      "carisma",
      "engenharia",
      "furtividade",
      "influencia",
      "intimidacao",
      "logica",
      "luta",
      "mobilidade",
      "percepcao",
      "precisao",
      "psicologia",
      "reflexos",
      "robotica",
      "sociedade",
      "tecnomagia",
      "vigor",
      "vontade"
    ],
    "status": [
      "draft",
      "published",
      "archived"
    ],
    "recursos": [
      "pv",
      "pe",
      "mana",
      "integridade",
      "pv_temporario",
      "mana_temporaria",
      "pa",
      "sobrecarga"
    ],
    "tipos_dano": [
      "fisico",
      "energetico",
      "acido",
      "toxico",
      "psiquico",
      "trauma"
    ],
    "vertentes": [
      "cinetica",
      "energetica",
      "material",
      "somatica",
      "sinaptica",
      "cognitiva"
    ],
    "operadores_formula": [
      "+",
      "-",
      "*",
      "/",
      "floor",
      "ceil",
      "min",
      "max"
    ],
    "tags_rolagem": [
      "acao",
      "agilidade",
      "analise",
      "arcano",
      "arma_de_fogo",
      "arma_energetica",
      "arremesso",
      "atencao",
      "audicao",
      "ciencia",
      "cinetica",
      "cognitiva",
      "combate",
      "conhecimento",
      "conjuracao",
      "construcao",
      "coordenacao",
      "corpo",
      "corpo_a_corpo",
      "criatividade",
      "cultura",
      "deducao",
      "defensiva",
      "discricao",
      "distancia",
      "drones",
      "emocao",
      "emocional",
      "empatia",
      "energetica",
      "expressao",
      "historia",
      "magia",
      "malha",
      "manipulacao",
      "material",
      "medicina",
      "medo",
      "mente",
      "mira",
      "movimento",
      "ocultacao",
      "ofensiva",
      "performance",
      "pericia",
      "persuasao",
      "politica",
      "presenca",
      "pressao",
      "programacao",
      "raciocinio",
      "reacao",
      "reparo",
      "resistencia",
      "resistencia_mental",
      "robos",
      "sentido",
      "sinaptica",
      "sobrecarga",
      "social",
      "somatica",
      "tecnica",
      "tecnomagia",
      "toxicologia",
      "trama",
      "velocidade",
      "vida",
      "visao"
    ],
    "sistemas_personagem": [
      "reacoes",
      "sobrecarga",
      "ruptura",
      "integridade",
      "colapso",
      "descanso",
      "evolucao"
    ],
    "derivados": [
      "pv_max",
      "pe_max",
      "mana_max",
      "integridade_max",
      "reacoes_por_rodada",
      "andar_m",
      "correr_m",
      "pa_max"
    ]
  },
  "rolagem": {
    "id": "rolagem_base",
    "dado": "d8",
    "pool": {
      "quantidade": {
        "ref": "atributo",
        "id": "atributo_escolhido"
      },
      "seleciona": "maior"
    },
    "resultado_label": "maior d8 rolado + perícia + modificadores",
    "status": "published",
    "versao": "1.1.0",
    "adicionar_ao_resultado": [
      {
        "ref": "pericia",
        "id": "pericia_escolhida"
      },
      {
        "ref": "modificadores",
        "id": "modificadores_ativos"
      }
    ]
  },
  "criacao_personagem": {
    "atributos": {
      "valor_inicial": 1,
      "pontos_adicionais": 3,
      "maximo_na_criacao": 3,
      "maximo_absoluto": 5
    },
    "pericias": {
      "pontos_totais": 25,
      "maximo_na_criacao": 3,
      "maximo_absoluto": 5,
      "total_pericias": 22
    },
    "status": "published",
    "versao": "1.1.0",
    "pa_base": 3,
    "vertentes": {
      "pontos_totais": 3,
      "total_vertentes": 6,
      "validar_requisitos_atributo_por_nivel": true
    },
    "talento_inicial": {
      "quantidade": 1,
      "nivel": 1
    },
    "inventario": {
      "aretz_iniciais": 5000,
      "raridade_maxima_compra_criacao": "incomum",
      "raridades_bloqueadas": [
        "raro",
        "muito_raro"
      ],
      "saldo_restante_vira_aretz_inicial": true
    },
    "progressao": {
      "moeda": "pm",
      "custos": "placeholder_editavel",
      "pode_investir_em": [
        "atributo",
        "pericia",
        "vertente",
        "talento",
        "pa"
      ]
    }
  },
  "atributos": [
    {
      "id": "corpo",
      "slug": "corpo",
      "nome": "Corpo",
      "abreviacao": "C",
      "categoria": "atributo",
      "descricao_curta": "Força, vigor, agilidade e coordenação motora.",
      "descricao_longa": "Corpo é o canal físico do personagem. Tudo que envolve movimento, esforço ou reflexos passa por ele.",
      "valor_minimo": 1,
      "valor_maximo": 5,
      "maximo_criacao": 3,
      "pericias_primarias": [
        "balistica",
        "furtividade",
        "luta",
        "vigor",
        "mobilidade",
        "precisao",
        "reflexos"
      ],
      "pericias_alternativas": [
        {
          "pericia": "intimidacao",
          "contexto": "quando domínio físico fizer mais sentido do que presença inata"
        }
      ],
      "niveis": [
        {
          "valor": 1,
          "label": "Corpo mole",
          "descricao": "Movimentos imprecisos, perde o fôlego fácil. Quase tudo exige esforço dobrado."
        },
        {
          "valor": 2,
          "label": "Frango",
          "descricao": "Consegue acompanhar o ritmo e se virar em esforço físico moderado quando se empenha."
        },
        {
          "valor": 3,
          "label": "Atleta amador",
          "descricao": "Boa coordenação, fôlego estável e controle corporal visível. Confiável em ação."
        },
        {
          "valor": 4,
          "label": "Medalhista olímpico",
          "descricao": "Ágil, forte ou resistente o bastante para chamar atenção. Dificilmente perde o controle do próprio corpo."
        },
        {
          "valor": 5,
          "label": "Super-herói",
          "descricao": "Reflexo e potência em nível excepcional. O corpo responde com exatidão antes mesmo do pensamento."
        }
      ],
      "tags": [
        "atributo",
        "fisico",
        "movimento",
        "resistencia",
        "reflexo"
      ],
      "status": "published",
      "versao": "1.1.0",
      "created_at": "2026-06-24",
      "updated_at": "2026-06-24"
    },
    {
      "id": "mente",
      "slug": "mente",
      "nome": "Mente",
      "abreviacao": "M",
      "categoria": "atributo",
      "descricao_curta": "Raciocínio, foco, perspicácia e memória.",
      "descricao_longa": "Mente é o canal intelectual e cognitivo. Interpreta ambiente, processa informação e sustenta decisões sob pressão.",
      "valor_minimo": 1,
      "valor_maximo": 5,
      "maximo_criacao": 3,
      "pericias_primarias": [
        "arcanismo",
        "biologia",
        "engenharia",
        "logica",
        "percepcao",
        "psicologia",
        "robotica",
        "sociedade",
        "tecnomagia"
      ],
      "pericias_alternativas": [
        {
          "pericia": "balistica",